{
  "country": "NP",
  "year_ad": 2025,
  "jurisdiction": "regional:hill-districts",
  "holidays": [
    {
      "id": "np-hamro-2081-11-29-01",
      "ad_date": "2025-03-13",
      "name": {
        "ne": "फागु पुर्णिमा (पहाडी जिल्ला)"
      },
      "type": "restricted",
      "tags": [
        "government",
        "religious",
        "regional"
      ],
      "calendars": {
        "bs": {
          "year": 2081,
          "month": 11,
          "day": 29
        }
      }
    }
  ]
}
