{
  "country": "NP",
  "year_ad": 2025,
  "jurisdiction": "regional:tarai",
  "holidays": [
    {
      "id": "np-hamro-2081-12-01-01",
      "ad_date": "2025-03-14",
      "name": {
        "ne": "फागु पुर्णिमा (तराई होली)"
      },
      "type": "restricted",
      "tags": [
        "government",
        "religious",
        "regional"
      ],
      "calendars": {
        "bs": {
          "year": 2081,
          "month": 12,
          "day": 1
        }
      }
    }
  ]
}
