{
  "country": "NP",
  "year_ad": 2026,
  "jurisdiction": "regional:kathmandu-valley",
  "holidays": [
    {
      "id": "np-hamro-2082-12-04-01",
      "ad_date": "2026-03-18",
      "name": {
        "ne": "घोडेजात्रा (काठमाडौँ उपत्यकालाई बिदा)"
      },
      "type": "restricted",
      "tags": [
        "government",
        "religious",
        "regional"
      ],
      "calendars": {
        "bs": {
          "year": 2082,
          "month": 12,
          "day": 4
        }
      }
    },
    {
      "id": "np-hamro-2083-03-06-01",
      "ad_date": "2026-06-20",
      "name": {
        "ne": "भोटो जात्रा (काठमाडौँ उपत्यका बिदा)"
      },
      "type": "restricted",
      "tags": [
        "government",
        "religious",
        "regional"
      ],
      "calendars": {
        "bs": {
          "year": 2083,
          "month": 3,
          "day": 6
        }
      }
    },
    {
      "id": "np-hamro-2083-05-13-01",
      "ad_date": "2026-08-29",
      "name": {
        "ne": "गाईजात्रा (काठमाडौं उपत्यका बिदा)"
      },
      "type": "restricted",
      "tags": [
        "government",
        "religious",
        "regional"
      ],
      "calendars": {
        "bs": {
          "year": 2083,
          "month": 5,
          "day": 13
        }
      }
    },
    {
      "id": "np-hamro-2083-06-09-01",
      "ad_date": "2026-09-25",
      "name": {
        "ne": "इन्द्रजात्रा (काठमाडौं उपत्यका बिदा)"
      },
      "type": "restricted",
      "tags": [
        "government",
        "religious",
        "regional"
      ],
      "calendars": {
        "bs": {
          "year": 2083,
          "month": 6,
          "day": 9
        }
      }
    },
    {
      "id": "np-hamro-2083-09-09-04",
      "ad_date": "2026-12-24",
      "name": {
        "ne": "ज्यापु दिवस"
      },
      "type": "restricted",
      "tags": [
        "government",
        "regional",
        "other"
      ],
      "calendars": {
        "bs": {
          "year": 2083,
          "month": 9,
          "day": 9
        }
      }
    }
  ]
}
