{
  "country": "NP",
  "year_ad": 2022,
  "jurisdiction": "regional:kathmandu-valley",
  "holidays": [
    {
      "id": "np-hamro-2079-04-27-01",
      "ad_date": "2022-08-12",
      "name": {
        "ne": "गाईजात्रा"
      },
      "type": "restricted",
      "tags": [
        "government",
        "religious",
        "regional"
      ],
      "calendars": {
        "bs": {
          "year": 2079,
          "month": 4,
          "day": 27
        }
      }
    },
    {
      "id": "np-hamro-2079-05-24-01",
      "ad_date": "2022-09-09",
      "name": {
        "ne": "इन्द्रजात्रा"
      },
      "type": "restricted",
      "tags": [
        "government",
        "religious",
        "regional"
      ],
      "calendars": {
        "bs": {
          "year": 2079,
          "month": 5,
          "day": 24
        }
      }
    }
  ]
}
